{
  "$schema": "../../tooling/surface-contract/surface-contract.schema.json",
  "schemaVersion": 2,
  "id": "officer.dashboard",
  "title": "Officer dashboard",
  "audience": "officer",
  "owner": "apps/officer-console",
  "purpose": "Exception-first counts for the officer's agency: what requires action and what is pending review.",
  "routes": [
    {
      "path": "/dashboard",
      "app": "officer-console",
      "source": "apps/officer-console/src/routes/dashboard.tsx",
      "role": "dashboard"
    }
  ],
  "operations": [
    "listApplications",
    "listAmberQueue"
  ],
  "ads": [
    {
      "name": "PageHeader",
      "source": "apps/officer-console/src/routes/dashboard.tsx",
      "import": "@atlaskit/page-header"
    },
    {
      "name": "SectionMessage",
      "source": "apps/officer-console/src/routes/dashboard.tsx",
      "import": "@atlaskit/section-message"
    }
  ],
  "states": [
    {
      "surface": "dashboard",
      "required": [
        "loading",
        "populated",
        "no-exceptions",
        "error"
      ],
      "source": "apps/officer-console/src/routes/dashboard.tsx",
      "evidence": [
        "isLoading",
        "isError",
        "requiresAction"
      ]
    }
  ],
  "accessibility": [
    "all user-facing text is translated",
    "status is not communicated by color alone"
  ],
  "tests": [
    "apps/officer-console/e2e/application-flow.spec.ts"
  ],
  "rules": {
    "browserTransport": "operation-id-only",
    "agencyAuthority": "server-session",
    "pii": "no-national-id-or-hash",
    "interactiveTargetMinimumPx": 48,
    "positivePolarityOnly": true
  },
  "readiness": {
    "rung": "E2E-PROVEN",
    "evidence": {
      "e2e": [
        "apps/officer-console/e2e/application-flow.spec.ts"
      ]
    }
  }
}
