{
  "$schema": "../../tooling/surface-contract/surface-contract.schema.json",
  "schemaVersion": 2,
  "id": "officer.erasure-queue",
  "title": "DPO erasure queue",
  "audience": "officer",
  "owner": "packages/features/compliance",
  "purpose": "The data-protection officer's queue of pending erasure requests: decline with mandatory written grounds, or erase with its consequences stated. The applicant is never identified.",
  "routes": [
    {
      "path": "/compliance",
      "app": "officer-console",
      "source": "packages/features/compliance/src/routes/index.tsx",
      "role": "redirect"
    },
    {
      "path": "/compliance/erasure-queue",
      "app": "officer-console",
      "source": "packages/features/compliance/src/routes/dpo-queue.tsx",
      "role": "queue"
    }
  ],
  "operations": [
    "listErasureRequests",
    "decideErasureRequest"
  ],
  "ads": [
    {
      "name": "Heading",
      "source": "packages/features/compliance/src/ui/DpoQueuePage.tsx",
      "import": "@atlaskit/heading"
    },
    {
      "name": "SectionMessage",
      "source": "packages/features/compliance/src/ui/DpoQueuePage.tsx",
      "import": "@atlaskit/section-message"
    },
    {
      "name": "QueueTable",
      "source": "packages/features/compliance/src/ui/DpoQueuePage.tsx",
      "import": "@usrp/ui"
    },
    {
      "name": "ConfirmAction",
      "source": "packages/features/compliance/src/ui/DpoQueuePage.tsx",
      "import": "@usrp/ui"
    }
  ],
  "states": [
    {
      "surface": "queue",
      "required": [
        "loading",
        "populated",
        "empty",
        "forbidden",
        "error"
      ],
      "source": "packages/features/compliance/src/ui/DpoQueuePage.tsx",
      "evidence": [
        "listState",
        "StateBoundary",
        "ERASURE_PERMISSIONS",
        "compliance.queue.anonymous_by_design"
      ]
    },
    {
      "surface": "decision",
      "required": [
        "idle",
        "pending",
        "success",
        "failure",
        "conflict"
      ],
      "source": "packages/features/compliance/src/ui/DpoQueuePage.tsx",
      "evidence": [
        "useDecideErasure",
        "ConfirmAction",
        "dpo-error",
        "compliance.execute.irreversible"
      ]
    }
  ],
  "accessibility": [
    "erasure consequences are stated in words before confirmation",
    "decline cannot be submitted without grounds",
    "all user-facing text is translated"
  ],
  "tests": [
    "apps/officer-console/e2e/dpo-erasure-queue.spec.ts",
    "packages/features/compliance/src/model/erasure.test.ts"
  ],
  "rules": {
    "browserTransport": "operation-id-only",
    "agencyAuthority": "server-session",
    "pii": "no-national-id-or-hash",
    "interactiveTargetMinimumPx": 48,
    "positivePolarityOnly": true
  },
  "readiness": {
    "rung": "E2E-PROVEN",
    "evidence": {
      "e2e": [
        "apps/officer-console/e2e/dpo-erasure-queue.spec.ts"
      ],
      "contract": "29f34aa53bc94b3ae246ca82fcad8310404afe98"
    }
  }
}
